[
  {
    "schema_version": "2.0.0",
    "source_id": "cfsrc:caseforge.india.admissibility-rules:0caf5bae57db9c22",
    "title": "The Indian Evidence Act, 1872",
    "jurisdiction": "India",
    "jurisdiction_path": [
      "India",
      "Central Law",
      "Evidence"
    ],
    "authority_type": "STATUTE",
    "issuing_authority": "Parliament of India",
    "citation": "Act No. 1 of 1872",
    "section": "Section 65B",
    "effective_from": "1872-09-01",
    "effective_to": "2024-06-30",
    "version": "India Code official text (verbatim extract of the criminal-codes pack)",
    "amendment": "As published on India Code on the fetch date; amendments shown in official footnotes are not reproduced",
    "source_file": "content/evidence_law_extract.txt",
    "page": 1,
    "paragraph": "Section 65B",
    "heading_path": [
      "The Indian Evidence Act, 1872",
      "Section 65B"
    ],
    "exact_text": "65B. Admissibility of electronic records.––(1) Notwithstanding anything contained in this Act, any\ninformation contained in an electronic record which is printed on a paper, stored, recorded or copied in\noptical or magnetic media produced by a computer (hereinafter referred to as the computer output) shall\nbe deemed to be also a document, if the conditions mentioned in this section are satisfied in relation to the\ninformation and computer in question and shall be admissible in any proceedings, without further proof or\nproduction of the original, as evidence or any contents of the original or of any fact stated therein of\nwhich direct evidence would be admissible.\n(2) The conditions referred to in sub-section (1) in respect of a computer output shall be the\nfollowing, namely:––\n(a) the computer output containing the information was produced by the computer during the\nperiod over which the computer was used regularly to store or process information for the\npurposes of any activities regularly carried on over that period by the person having lawful\ncontrol over the use of the computer;\n(b) during the said period, information of the kind contained in the electronic record or of the\nkind from which the information so contained is derived was regularly fed into the computer in\nthe ordinary course of the said activities;\n(c) throughout the material part of the said period, the computer was operating properly or, if\nnot, then in respect of any period in which it was not operating properly or was out of operation\nduring that part of the period, was not such as to affect the electronic record or the accuracy of its\ncontents; and\n(d) the information contained in the electronic record reproduces or is derived from such\ninformation fed into the computer in the ordinary course of the said activities.\n(3) Where over any period, the function of storing or processing information for the purposes of\nany activities regularly carried on over that period as mentioned in clause (a) of sub-section (2) was\nregularly performed by computers, whether––\n(a) by a combination of computers operating over that period; or\n(b) by different computers operating in succession over that period; or\n(c) by different combinations of computers operating in succession over that period; or\n(d) in any other manner involving the successive operation over that period, in whatever\norder, of one or more computers and one or more combinations of computers,\nall the computers used for that purpose during that period shall be treated for the purposes of this\nsection as constituting a single computer; and references in this section to a computer shall be\nconstrued accordingly.\n(4) In any proceedings where it is desired to give a statement in evidence by virtue of this section,\na certificate doing any of the following things, that is to say,––\n(a) identifying the electronic record containing the statement and describing the manner in\nwhich it was produced;\n(b) giving such particulars of any device involved in the production of that electronic record\nas may be appropriate for the purpose of showing that the electronic record was produced by a\ncomputer;\n(c) dealing with any of the matters to which the conditions mentioned in\nsub-section (2) relate,\nand purporting to be signed by a person occupying a responsible official position in relation to the\noperation of the relevant device or the management of the relevant activities (whichever is\nappropriate) shall be evidence of any matter stated in the certificate; and for the purposes of this\nsub-section it shall be sufficient for a matter to be stated to the best of the knowledge and belief of the\nperson stating it.\n(5) For the purposes of this section,––\n(a) information shall be taken to be supplied to a computer if it is supplied thereto in any\nappropriate form and whether it is so supplied directly or (with or without human intervention) by\nmeans of any appropriate equipment;\n(b) whether in the course of activities carried on by any official, information is supplied with\na view to its being stored or processed for the purposes of those activities by a computer operated\notherwise than in the course of those activities, that information, if duly supplied to that\ncomputer, shall be taken to be supplied to it in the course of those activities;\n(c) a computer output shall be taken to have been produced by a computer whether it was\nproduced by it directly or (with or without human intervention) by means of any appropriate\nequipment.\nExplanation.––For the purposes of this section any reference to information being derived from other\ninformation shall be a reference to its being derived therefrom by calculation, comparison or any other\nprocess.]",
    "checksum": "sha256:0caf5bae57db9c22c3c30927f0b8250d89c50c3cd68d0142764e2bdc1d960e16",
    "pack_id": "caseforge.india.admissibility-rules",
    "trust_level": "OFFICIAL_VERIFIED",
    "superseded_status": "SUPERSEDED",
    "publisher": "India Code, Ministry of Law and Justice, Legislative Department",
    "source_reference": "https://indiacode.gov.in/handle/123456789/488783",
    "content_kind": "AUTHORITATIVE_TEXT",
    "derived_from_source_id": null,
    "holding_tags": [],
    "proposition_tags": [
      "admissibility",
      "foundation",
      "evidence"
    ]
  },
  {
    "schema_version": "2.0.0",
    "source_id": "cfsrc:caseforge.india.admissibility-rules:b091e0ddb34b29f2",
    "title": "The Bharatiya Sakshya Adhiniyam, 2023",
    "jurisdiction": "India",
    "jurisdiction_path": [
      "India",
      "Central Law",
      "Evidence"
    ],
    "authority_type": "STATUTE",
    "issuing_authority": "Parliament of India",
    "citation": "Act No. 47 of 2023",
    "section": "Section 63",
    "effective_from": "2024-07-01",
    "effective_to": "UNKNOWN",
    "version": "India Code official text (verbatim extract of the criminal-codes pack)",
    "amendment": "As published on India Code on the fetch date; amendments shown in official footnotes are not reproduced",
    "source_file": "content/evidence_law_extract.txt",
    "page": 1,
    "paragraph": "Section 63",
    "heading_path": [
      "The Bharatiya Sakshya Adhiniyam, 2023",
      "Section 63"
    ],